{
  "$schema": "https://json-schema.org/draft/2020-12/schema",
  "$id": "https://example.invalid/schema/materials.schema.json",
  "title": "Material table",
  "description": "DESIGN.md §6.2. This file is the modding API described in §14.5 — 'a mod is a materials file' — so it is written as a public contract rather than an internal note. Every value is in game units, not SI: §3 lists physical accuracy as an explicit non-goal, and §6.2 asks only for monotonicity and consistent ratios.",
  "type": "object",
  "required": ["tags", "classes", "materials"],
  "additionalProperties": false,
  "properties": {
    "$comment": { "type": "string" },
    "tags": {
      "description": "Role tags, in order. A material's index in this list is its bit, so appending is safe and reordering is not. Reactions match on these rather than on material identity, which is what keeps the interaction matrix authorable without an N² table (§6.2).",
      "type": "array",
      "maxItems": 32,
      "uniqueItems": true,
      "items": { "type": "string", "pattern": "^[a-z][a-z0-9_]*$" }
    },
    "classes": {
      "description": "Taxonomy only. §6.2: 'no mechanical effect'. Used for the base hue in §12.1 and for nothing else.",
      "type": "array",
      "uniqueItems": true,
      "items": { "type": "string", "pattern": "^[a-z][a-z0-9_]*$" }
    },
    "materials": {
      "type": "array",
      "minItems": 1,
      "items": { "$ref": "#/$defs/material" }
    }
  },
  "$defs": {
    "unit": {
      "description": "A normalised 0..1 property.",
      "type": "number",
      "minimum": 0,
      "maximum": 1
    },
    "material": {
      "type": "object",
      "required": [
        "id",
        "class",
        "density",
        "hardness",
        "toughness",
        "elasticity",
        "friction",
        "heat_capacity",
        "thermal_conductivity",
        "conductivity",
        "aether_permeability",
        "aether_capacity",
        "discharge_threshold",
        "corrosion_resistance"
      ],
      "additionalProperties": false,
      "properties": {
        "$comment": { "type": "string" },
        "id": { "type": "string", "pattern": "^[a-z][a-z0-9_]*$" },
        "class": { "type": "string" },
        "tags": { "type": "array", "items": { "type": "string" }, "uniqueItems": true },

        "density": { "type": "number", "exclusiveMinimum": 0, "maximum": 100 },
        "hardness": {
          "description": "Stress a part sustains before it deforms. Zero means fluid: no deformation threshold and no fracture, only displacement.",
          "type": "number",
          "minimum": 0,
          "maximum": 100
        },
        "toughness": {
          "description": "Resistance to fracture. §6.2: hardness up / toughness down is the normal relationship, and a material that breaks it is automatically interesting and should be rare.",
          "$ref": "#/$defs/unit"
        },
        "elasticity": {
          "description": "Fraction of arriving mechanical energy handed straight back rather than absorbed.",
          "$ref": "#/$defs/unit"
        },
        "friction": {
          "description": "Fraction of absorbed mechanical energy that becomes heat. This is why grinding warms things.",
          "$ref": "#/$defs/unit"
        },

        "heat_capacity": { "type": "number", "exclusiveMinimum": 0, "maximum": 100 },
        "thermal_conductivity": { "type": "number", "minimum": 0, "maximum": 100 },

        "conductivity": {
          "description": "Charge transfer. Also decides which nearby part an over-threshold arc reaches for.",
          "type": "number",
          "minimum": 0,
          "maximum": 100
        },
        "aether_permeability": {
          "description": "How readily fields pass through. High permeability makes a good conduit and a poor battery.",
          "$ref": "#/$defs/unit"
        },
        "aether_capacity": { "type": "number", "minimum": 0, "maximum": 1000 },
        "discharge_threshold": {
          "description": "Charge held before arcing. Should not exceed aether_capacity.",
          "type": "number",
          "minimum": 0,
          "maximum": 1000
        },
        "corrosion_resistance": { "$ref": "#/$defs/unit" },

        "phase_points": { "$ref": "#/$defs/phaseTemps" },
        "phase_products": { "$ref": "#/$defs/phaseProducts" },
        "phase_energy": { "$ref": "#/$defs/phaseEnergy" },

        "reactions": {
          "type": "array",
          "items": { "$ref": "#/$defs/reaction" }
        },
        "formation": { "$ref": "#/$defs/formation" },
        "appearance": {
          "type": "object",
          "additionalProperties": false,
          "properties": {
            "derive_from_properties": { "type": "boolean" },
            "hue_bias": { "type": "number", "minimum": -360, "maximum": 360 }
          }
        }
      }
    },
    "phaseTemps": {
      "description": "Threshold temperatures. `melt`, `boil` and `ignite` are crossed on the way up; `solidify` is crossed on the way down and is this implementation's one addition to the §6.2 schema (without it nothing can freeze). Omit or null a transition a material does not have.",
      "type": "object",
      "additionalProperties": false,
      "properties": {
        "melt": { "type": ["number", "null"] },
        "boil": { "type": ["number", "null"] },
        "ignite": { "type": ["number", "null"] },
        "solidify": { "type": ["number", "null"] }
      }
    },
    "phaseProducts": {
      "description": "What the part becomes. Every transition with a temperature needs one.",
      "type": "object",
      "additionalProperties": false,
      "properties": {
        "melt": { "type": "string" },
        "boil": { "type": "string" },
        "ignite": { "type": "string" },
        "solidify": { "type": "string" }
      }
    },
    "phaseEnergy": {
      "description": "Latent energy per unit volume. For melt/boil/solidify this is the size of the plateau the part holds at while the transition is paid for, and a reversible pair must not net positive around the loop — tools/fuzz.ts decides that. For ignite it is the chemical energy released, and it is what makes a fire hotter than the thing that lit it.",
      "type": "object",
      "additionalProperties": false,
      "properties": {
        "melt": { "type": "number", "minimum": 0 },
        "boil": { "type": "number", "minimum": 0 },
        "ignite": { "type": "number" },
        "solidify": { "type": "number", "minimum": 0 }
      }
    },
    "reaction": {
      "type": "object",
      "required": ["with", "produces", "rate"],
      "additionalProperties": false,
      "properties": {
        "with": {
          "description": "Tag pattern the arriving reagent must carry, written `*:tagname`.",
          "type": "string",
          "pattern": "^(\\*:)?[a-z][a-z0-9_]*$"
        },
        "produces": { "type": "string" },
        "rate": {
          "description": "Volume converted per unit of corrosive potential, before the target's corrosion resistance.",
          "type": "number",
          "minimum": 0
        },
        "releases": {
          "type": "object",
          "additionalProperties": false,
          "properties": {
            "thermal": {
              "description": "Energy per unit volume converted. Negative absorbs — an endothermic reaction is a cold weapon.",
              "type": "number"
            }
          }
        }
      }
    },
    "formation": {
      "description": "§7.1 layer 6: which conditions can produce this material. Carried through validation and deliberately not packed into the simulation — worldgen is M2, and §14.5 says not to foreclose it.",
      "type": "object",
      "additionalProperties": false,
      "properties": {
        "requires": {
          "type": "object",
          "additionalProperties": false,
          "properties": {
            "temperature": { "$ref": "#/$defs/range" },
            "aether_density": { "$ref": "#/$defs/range" },
            "depth": { "$ref": "#/$defs/range" }
          }
        },
        "abundance": { "$ref": "#/$defs/unit" }
      }
    },
    "range": {
      "type": "array",
      "minItems": 2,
      "maxItems": 2,
      "items": { "type": "number" }
    }
  }
}
