{
  "$comment": "DESIGN.md \u00a74.2 and \u00a74.4. This file is the deliverable, not the scaffolding around it. Values are game units, not SI: what matters is monotonicity and consistent ratios (\u00a74.2). `class` is taxonomy only and has no mechanical effect. `formation` is carried for \u00a75.1 layer 6 and is deliberately not packed into the simulation yet \u2014 worldgen is M2. `solidify` is a downward phase crossing; see sim/src/material.rs for why the \u00a74.2 schema needs it.",
  "tags": [
    "solvent",
    "acid",
    "base",
    "oxidiser",
    "reducer",
    "fuel",
    "water",
    "salt",
    "metal",
    "organic",
    "mineral",
    "aetheric",
    "abrasive",
    "volatile"
  ],
  "classes": [
    "mineral",
    "metal",
    "organic",
    "fluid",
    "gas",
    "aetheric",
    "residue"
  ],
  "materials": [
    {
      "id": "granite",
      "class": "mineral",
      "tags": [
        "mineral",
        "abrasive"
      ],
      "density": 2.7,
      "hardness": 6.0,
      "toughness": 0.3,
      "elasticity": 0.1,
      "friction": 0.65,
      "heat_capacity": 0.8,
      "thermal_conductivity": 0.35,
      "conductivity": 0.02,
      "aether_permeability": 0.25,
      "aether_capacity": 2.0,
      "discharge_threshold": 1.6,
      "corrosion_resistance": 0.85,
      "phase_points": {
        "melt": 1200
      },
      "phase_products": {
        "melt": "magma"
      },
      "phase_energy": {
        "melt": 200
      },
      "reactions": [
        {
          "with": "*:acid",
          "produces": "grit",
          "rate": 0.05,
          "releases": {
            "thermal": 5
          }
        }
      ],
      "formation": {
        "requires": {
          "temperature": [
            -40,
            900
          ],
          "aether_density": [
            0.0,
            1.0
          ],
          "depth": [
            0,
            4000
          ]
        },
        "abundance": 0.3
      },
      "appearance": {
        "derive_from_properties": true,
        "hue_bias": 25
      }
    },
    {
      "id": "chalkstone",
      "class": "mineral",
      "tags": [
        "mineral",
        "base"
      ],
      "density": 1.9,
      "hardness": 1.6,
      "toughness": 0.12,
      "elasticity": 0.05,
      "friction": 0.7,
      "heat_capacity": 0.9,
      "thermal_conductivity": 0.3,
      "conductivity": 0.02,
      "aether_permeability": 0.3,
      "aether_capacity": 1.5,
      "discharge_threshold": 1.2,
      "corrosion_resistance": 0.15,
      "phase_points": {
        "melt": 900
      },
      "phase_products": {
        "melt": "magma"
      },
      "phase_energy": {
        "melt": 200
      },
      "reactions": [
        {
          "with": "*:acid",
          "produces": "quicklime",
          "rate": 0.9,
          "releases": {
            "thermal": 600
          }
        }
      ],
      "formation": {
        "requires": {
          "temperature": [
            -20,
            60
          ],
          "aether_density": [
            0.0,
            0.6
          ],
          "depth": [
            0,
            300
          ]
        },
        "abundance": 0.22
      },
      "appearance": {
        "derive_from_properties": true,
        "hue_bias": 48
      }
    },
    {
      "id": "obsidian",
      "class": "mineral",
      "tags": [
        "mineral",
        "abrasive"
      ],
      "density": 2.4,
      "hardness": 8.5,
      "toughness": 0.04,
      "elasticity": 0.06,
      "friction": 0.35,
      "heat_capacity": 0.7,
      "thermal_conductivity": 0.3,
      "conductivity": 0.01,
      "aether_permeability": 0.45,
      "aether_capacity": 3.0,
      "discharge_threshold": 2.4,
      "corrosion_resistance": 0.92,
      "phase_points": {
        "melt": 850
      },
      "phase_products": {
        "melt": "magma"
      },
      "phase_energy": {
        "melt": 200
      },
      "reactions": [
        {
          "with": "*:acid",
          "produces": "grit",
          "rate": 0.03,
          "releases": {
            "thermal": 4
          }
        }
      ],
      "formation": {
        "requires": {
          "temperature": [
            -20,
            200
          ],
          "aether_density": [
            0.1,
            0.8
          ],
          "depth": [
            0,
            600
          ]
        },
        "abundance": 0.05
      },
      "appearance": {
        "derive_from_properties": true,
        "hue_bias": 265
      }
    },
    {
      "id": "hoarfrost_quartz",
      "class": "mineral",
      "tags": [
        "mineral",
        "aetheric"
      ],
      "$comment": "\u00a74.2's worked example, kept as authored except for the melt point. The document's -20 makes the material a liquid at any habitable temperature, which is not what the surrounding prose describes; 45 keeps it solid in hand and liquid near a forge, which is the behaviour \u00a74.3 promises.",
      "density": 2.1,
      "hardness": 7.2,
      "toughness": 0.18,
      "elasticity": 0.3,
      "friction": 0.42,
      "heat_capacity": 0.55,
      "thermal_conductivity": 0.81,
      "conductivity": 0.05,
      "aether_permeability": 0.9,
      "aether_capacity": 3.4,
      "discharge_threshold": 2.8,
      "corrosion_resistance": 0.66,
      "phase_points": {
        "melt": 45,
        "boil": 140
      },
      "phase_products": {
        "melt": "quartz_melt",
        "boil": "aether_vapor"
      },
      "phase_energy": {
        "melt": 90,
        "boil": 220
      },
      "reactions": [
        {
          "with": "*:solvent",
          "produces": "quartz_slurry",
          "rate": 0.4,
          "releases": {
            "thermal": -12
          }
        },
        {
          "with": "*:reducer",
          "produces": "raw_quartz",
          "rate": 0.1,
          "releases": {
            "thermal": 0
          }
        }
      ],
      "formation": {
        "requires": {
          "temperature": [
            -40,
            -5
          ],
          "aether_density": [
            0.6,
            1.0
          ],
          "depth": [
            20,
            200
          ]
        },
        "abundance": 0.03
      },
      "appearance": {
        "derive_from_properties": true,
        "hue_bias": 195
      }
    },
    {
      "id": "raw_quartz",
      "class": "mineral",
      "tags": [
        "mineral",
        "abrasive"
      ],
      "$comment": "Refined quartz: the aether is what the reduction strips out, so it is a better abrasive and a worse conduit.",
      "density": 2.2,
      "hardness": 7.4,
      "toughness": 0.16,
      "elasticity": 0.28,
      "friction": 0.5,
      "heat_capacity": 0.6,
      "thermal_conductivity": 0.4,
      "conductivity": 0.02,
      "aether_permeability": 0.2,
      "aether_capacity": 1.2,
      "discharge_threshold": 1.0,
      "corrosion_resistance": 0.88,
      "phase_points": {
        "melt": 1300
      },
      "phase_products": {
        "melt": "magma"
      },
      "phase_energy": {
        "melt": 200
      },
      "reactions": [],
      "formation": {
        "requires": {
          "temperature": [
            -40,
            400
          ],
          "aether_density": [
            0.0,
            0.4
          ],
          "depth": [
            0,
            900
          ]
        },
        "abundance": 0.14
      },
      "appearance": {
        "derive_from_properties": true,
        "hue_bias": 35
      }
    },
    {
      "id": "basalt",
      "class": "mineral",
      "tags": [
        "mineral"
      ],
      "density": 3.0,
      "hardness": 6.5,
      "toughness": 0.35,
      "elasticity": 0.12,
      "friction": 0.72,
      "heat_capacity": 0.9,
      "thermal_conductivity": 0.32,
      "conductivity": 0.03,
      "aether_permeability": 0.22,
      "aether_capacity": 1.8,
      "discharge_threshold": 1.4,
      "corrosion_resistance": 0.88,
      "phase_points": {
        "melt": 1100
      },
      "phase_products": {
        "melt": "magma"
      },
      "phase_energy": {
        "melt": 245
      },
      "reactions": [],
      "formation": {
        "requires": {
          "temperature": [
            -40,
            900
          ],
          "aether_density": [
            0.0,
            1.0
          ],
          "depth": [
            0,
            5000
          ]
        },
        "abundance": 0.28
      },
      "appearance": {
        "derive_from_properties": true,
        "hue_bias": 210
      }
    },
    {
      "id": "sulphur_nodule",
      "class": "mineral",
      "tags": [
        "mineral",
        "fuel",
        "volatile"
      ],
      "density": 2.0,
      "hardness": 1.2,
      "toughness": 0.08,
      "elasticity": 0.05,
      "friction": 0.55,
      "heat_capacity": 0.7,
      "thermal_conductivity": 0.12,
      "conductivity": 0.02,
      "aether_permeability": 0.3,
      "aether_capacity": 1.0,
      "discharge_threshold": 0.8,
      "corrosion_resistance": 0.3,
      "phase_points": {
        "ignite": 240
      },
      "phase_products": {
        "ignite": "slag"
      },
      "phase_energy": {
        "ignite": 2000
      },
      "reactions": [
        {
          "with": "*:oxidiser",
          "produces": "blastfire",
          "rate": 0.8,
          "releases": {
            "thermal": 700
          }
        }
      ],
      "formation": {
        "requires": {
          "temperature": [
            40,
            400
          ],
          "aether_density": [
            0.0,
            0.7
          ],
          "depth": [
            0,
            800
          ]
        },
        "abundance": 0.04
      },
      "appearance": {
        "derive_from_properties": true,
        "hue_bias": 55
      }
    },
    {
      "id": "saltpetre",
      "class": "mineral",
      "tags": [
        "mineral",
        "oxidiser",
        "salt"
      ],
      "density": 2.1,
      "hardness": 1.0,